{
  "schemaVersion": "tennis-catalogue.v1",
  "season": 2026,
  "generatedAt": "2026-10-11T12:36:44.014Z",
  "ingestionMode": "mixed",
  "refreshPolicy": {
    "rankingsCadence": "weekly",
    "maximumRankingAgeDays": 9,
    "maximumConfirmedPublicationLagDays": 16,
    "maximumPublicationCheckAgeDays": 2,
    "parityRequired": false,
    "independentPublicationFreshnessRequired": true,
    "failureMode": "retain_last_good_and_fail_closed"
  },
  "sources": [
    {
      "provider": "ATP Tour",
      "tour": "ATP",
      "sourceUrl": "https://www.protennislive.com/posting/ramr/singles_entry_numerical.pdf",
      "effectiveDate": "2026-10-05",
      "observedAt": "2026-10-11T12:36:44.014Z",
      "publicationCheckedAt": "2026-10-11T12:36:44.014Z",
      "publicationUrl": "https://www.atptour.com/en/media/rankings-and-stats",
      "sourceTrust": "verified",
      "ingestionMode": "public_first_party",
      "fixturePath": "feeds/provider-exports/tennis/atp-singles-2026-10-05.json"
    },
    {
      "provider": "WTA",
      "tour": "WTA",
      "sourceUrl": "https://api.wtatennis.com/tennis/players/ranked",
      "effectiveDate": "2026-09-28",
      "observedAt": "2026-10-11T12:36:44.014Z",
      "publicationCheckedAt": "2026-10-11T12:36:44.014Z",
      "publicationUrl": "https://www.wtatennis.com/rankings/singles",
      "sourceTrust": "verified",
      "ingestionMode": "public_first_party",
      "fixturePath": "feeds/provider-exports/tennis/wta-singles-2026-09-28.json"
    },
    {
      "provider": "ATP Tour",
      "sourceUrl": "https://www.atptour.com/en/news/what-is-the-2026-atp-tour-calendar",
      "observedAt": "2026-09-22T01:00:00.000Z",
      "ingestionMode": "manual_reviewed_export",
      "fixturePath": "feeds/provider-exports/tennis/tournaments-2026-reviewed.json"
    },
    {
      "provider": "WTA",
      "sourceUrl": "https://wtafiles.wtatennis.com/pdf/calendar/calendar.pdf",
      "observedAt": "2026-09-22T01:00:00.000Z",
      "ingestionMode": "manual_reviewed_export",
      "fixturePath": "feeds/provider-exports/tennis/tournaments-2026-reviewed.json"
    },
    {
      "provider": "WTA",
      "sourceUrl": "https://www.wtatennis.com/tournaments/806/toronto/2026",
      "observedAt": "2026-09-22T01:00:00.000Z",
      "ingestionMode": "manual_reviewed_export",
      "fixturePath": "feeds/provider-exports/tennis/tournaments-2026-reviewed.json"
    }
  ],
  "athletes": [
    {
      "athleteId": "competitor:tennis:atp:jannik-sinner",
      "providerAlias": "atp:player:s0ag",
      "displayName": "Jannik Sinner",
      "tour": "ATP",
      "rankingSingles": 1,
      "rankingPoints": 11000,
      "rankingSnapshotDate": "2026-10-05",
      "rankingSourceTrust": "verified",
      "rankingPublicationCheckedAt": "2026-10-11T12:36:44.014Z",
      "nationalityCode": "ITA",
      "isAustralian": false,
      "active": true,
      "selectionReasons": [
        "top_50"
      ]
    },
    {
      "athleteId": "competitor:tennis:atp:alexander-zverev",
      "providerAlias": "atp:player:z355",
      "displayName": "Alexander Zverev",
      "tour": "ATP",
      "rankingSingles": 2,
      "rankingPoints": 9720,
      "rankingSnapshotDate": "2026-10-05",
      "rankingSourceTrust": "verified",
      "rankingPublicationCheckedAt": "2026-10-11T12:36:44.014Z",
      "nationalityCode": "GER",
      "isAustralian": false,
      "active": true,
      "selectionReasons": [
        "top_50"
      ]
    },
    {
      "athleteId": "competitor:tennis:atp:carlos-alcaraz",
      "providerAlias": "atp:player:a0e2",
      "displayName": "Carlos Alcaraz",
      "tour": "ATP",
      "rankingSingles": 3,
      "rankingPoints": 5560,
      "rankingSnapshotDate": "2026-10-05",
      "rankingSourceTrust": "verified",
      "rankingPublicationCheckedAt": "2026-10-11T12:36:44.014Z",
      "nationalityCode": "ESP",
      "isAustralian": false,
      "active": true,
      "selectionReasons": [
        "top_50"
      ]
    },
    {
      "athleteId": "competitor:tennis:atp:ben-shelton",
      "providerAlias": "atp:player:s0s1",
      "displayName": "Ben Shelton",
      "tour": "ATP",
      "rankingSingles": 4,
      "rankingPoints": 4680,
      "rankingSnapshotDate": "2026-10-05",
      "rankingSourceTrust": "verified",
      "rankingPublicationCheckedAt": "2026-10-11T12:36:44.014Z",
      "nationalityCode": "USA",
      "isAustralian": false,
      "active": true,
      "selectionReasons": [
        "top_50"
      ]
    },
    {
      "athleteId": "competitor:tennis:atp:felix-auger-aliassime",
      "providerAlias": "atp:player:ag37",
      "displayName": "Felix Auger Aliassime",
      "tour": "ATP",
      "rankingSingles": 5,
      "rankingPoints": 3890,
      "rankingSnapshotDate": "2026-10-05",
      "rankingSourceTrust": "verified",
      "rankingPublicationCheckedAt": "2026-10-11T12:36:44.014Z",
      "nationalityCode": "CAN",
      "isAustralian": false,
      "active": true,
      "selectionReasons": [
        "top_50"
      ]
    },
    {
      "athleteId": "competitor:tennis:atp:daniil-medvedev",
      "providerAlias": "atp:player:mm58",
      "displayName": "Daniil Medvedev",
      "tour": "ATP",
      "rankingSingles": 6,
      "rankingPoints": 3860,
      "rankingSnapshotDate": "2026-10-05",
      "rankingSourceTrust": "verified",
      "rankingPublicationCheckedAt": "2026-10-11T12:36:44.014Z",
      "nationalityCode": "RUS",
      "isAustralian": false,
      "active": true,
      "selectionReasons": [
        "top_50"
      ]
    },
    {
      "athleteId": "competitor:tennis:atp:flavio-cobolli",
      "providerAlias": "atp:player:c0e9",
      "displayName": "Flavio Cobolli",
      "tour": "ATP",
      "rankingSingles": 7,
      "rankingPoints": 3680,
      "rankingSnapshotDate": "2026-10-05",
      "rankingSourceTrust": "verified",
      "rankingPublicationCheckedAt": "2026-10-11T12:36:44.014Z",
      "nationalityCode": "ITA",
      "isAustralian": false,
      "active": true,
      "selectionReasons": [
        "top_50"
      ]
    },
    {
      "athleteId": "competitor:tennis:atp:novak-djokovic",
      "providerAlias": "atp:player:d643",
      "displayName": "Novak Djokovic",
      "tour": "ATP",
      "rankingSingles": 8,
      "rankingPoints": 3480,
      "rankingSnapshotDate": "2026-10-05",
      "rankingSourceTrust": "verified",
      "rankingPublicationCheckedAt": "2026-10-11T12:36:44.014Z",
      "nationalityCode": "SRB",
      "isAustralian": false,
      "active": true,
      "selectionReasons": [
        "top_50"
      ]
    },
    {
      "athleteId": "competitor:tennis:atp:alex-de-minaur",
      "providerAlias": "atp:player:dh58",
      "displayName": "Alex De Minaur",
      "tour": "ATP",
      "rankingSingles": 9,
      "rankingPoints": 3430,
      "rankingSnapshotDate": "2026-10-05",
      "rankingSourceTrust": "verified",
      "rankingPublicationCheckedAt": "2026-10-11T12:36:44.014Z",
      "nationalityCode": "AUS",
      "isAustralian": true,
      "active": true,
      "selectionReasons": [
        "australian",
        "top_50"
      ]
    },
    {
      "athleteId": "competitor:tennis:atp:frances-tiafoe",
      "providerAlias": "atp:player:td51",
      "displayName": "Frances Tiafoe",
      "tour": "ATP",
      "rankingSingles": 10,
      "rankingPoints": 3380,
      "rankingSnapshotDate": "2026-10-05",
      "rankingSourceTrust": "verified",
      "rankingPublicationCheckedAt": "2026-10-11T12:36:44.014Z",
      "nationalityCode": "USA",
      "isAustralian": false,
      "active": true,
      "selectionReasons": [
        "top_50"
      ]
    },
    {
      "athleteId": "competitor:tennis:atp:arthur-fils",
      "providerAlias": "atp:player:f0f1",
      "displayName": "Arthur Fils",
      "tour": "ATP",
      "rankingSingles": 11,
      "rankingPoints": 3275,
      "rankingSnapshotDate": "2026-10-05",
      "rankingSourceTrust": "verified",
      "rankingPublicationCheckedAt": "2026-10-11T12:36:44.014Z",
      "nationalityCode": "FRA",
      "isAustralian": false,
      "active": true,
      "selectionReasons": [
        "top_50"
      ]
    },
    {
      "athleteId": "competitor:tennis:atp:taylor-fritz",
      "providerAlias": "atp:player:fb98",
      "displayName": "Taylor Fritz",
      "tour": "ATP",
      "rankingSingles": 12,
      "rankingPoints": 2880,
      "rankingSnapshotDate": "2026-10-05",
      "rankingSourceTrust": "verified",
      "rankingPublicationCheckedAt": "2026-10-11T12:36:44.014Z",
      "nationalityCode": "USA",
      "isAustralian": false,
      "active": true,
      "selectionReasons": [
        "top_50"
      ]
    },
    {
      "athleteId": "competitor:tennis:atp:rafael-jodar",
      "providerAlias": "atp:player:j0dz",
      "displayName": "Rafael Jodar",
      "tour": "ATP",
      "rankingSingles": 13,
      "rankingPoints": 2659,
      "rankingSnapshotDate": "2026-10-05",
      "rankingSourceTrust": "verified",
      "rankingPublicationCheckedAt": "2026-10-11T12:36:44.014Z",
      "nationalityCode": "ESP",
      "isAustralian": false,
      "active": true,
      "selectionReasons": [
        "top_50"
      ]
    },
    {
      "athleteId": "competitor:tennis:atp:valentin-vacherot",
      "providerAlias": "atp:player:va25",
      "displayName": "Valentin Vacherot",
      "tour": "ATP",
      "rankingSingles": 14,
      "rankingPoints": 2450,
      "rankingSnapshotDate": "2026-10-05",
      "rankingSourceTrust": "verified",
      "rankingPublicationCheckedAt": "2026-10-11T12:36:44.014Z",
      "nationalityCode": "MON",
      "isAustralian": false,
      "active": true,
      "selectionReasons": [
        "top_50"
      ]
    },
    {
      "athleteId": "competitor:tennis:atp:jakub-mensik",
      "providerAlias": "atp:player:m0ni",
      "displayName": "Jakub Mensik",
      "tour": "ATP",
      "rankingSingles": 15,
      "rankingPoints": 2445,
      "rankingSnapshotDate": "2026-10-05",
      "rankingSourceTrust": "verified",